{
  "format": "yarramate/graph/v2",
  "profiles": [
    "yarramate/core@0.1"
  ],
  "documents": [
    {
      "id": "governed-change",
      "source": "test/fixtures/valid/governed-change.yaml"
    }
  ],
  "subjects": [
    {
      "id": "governed-change#adoption-realizes-suite",
      "type": "relationship"
    },
    {
      "id": "governed-change#ai-change-risk",
      "type": "concept"
    },
    {
      "id": "governed-change#approval-artifact",
      "type": "concept"
    },
    {
      "id": "governed-change#approval-decision",
      "type": "concept"
    },
    {
      "id": "governed-change#approval-interface",
      "type": "concept"
    },
    {
      "id": "governed-change#approval-record",
      "type": "concept"
    },
    {
      "id": "governed-change#approval-requested",
      "type": "concept"
    },
    {
      "id": "governed-change#approval-supports-integrity",
      "type": "relationship"
    },
    {
      "id": "governed-change#artifact-realizes-record",
      "type": "relationship"
    },
    {
      "id": "governed-change#attributable-approval",
      "type": "concept"
    },
    {
      "id": "governed-change#board-member",
      "type": "concept"
    },
    {
      "id": "governed-change#conformance-suite",
      "type": "concept"
    },
    {
      "id": "governed-change#constraint-enforces-approval",
      "type": "relationship"
    },
    {
      "id": "governed-change#control-plane",
      "type": "concept"
    },
    {
      "id": "governed-change#control-plane-assigned-to-edge",
      "type": "relationship"
    },
    {
      "id": "governed-change#control-plane-performs-verification",
      "type": "relationship"
    },
    {
      "id": "governed-change#control-plane-realizes-intent-match",
      "type": "relationship"
    },
    {
      "id": "governed-change#decide-proposal",
      "type": "concept"
    },
    {
      "id": "governed-change#decision-gate-realizes-capability",
      "type": "relationship"
    },
    {
      "id": "governed-change#decision-serves-process",
      "type": "relationship"
    },
    {
      "id": "governed-change#drift-threatens-integrity",
      "type": "relationship"
    },
    {
      "id": "governed-change#edge-composes-runtime",
      "type": "relationship"
    },
    {
      "id": "governed-change#edge-runtime",
      "type": "concept"
    },
    {
      "id": "governed-change#execute-request",
      "type": "concept"
    },
    {
      "id": "governed-change#explicit-decision-gate",
      "type": "concept"
    },
    {
      "id": "governed-change#foundation",
      "type": "concept"
    },
    {
      "id": "governed-change#govern-ai-change",
      "type": "concept"
    },
    {
      "id": "governed-change#governed-publication",
      "type": "concept"
    },
    {
      "id": "governed-change#intent-digest",
      "type": "concept"
    },
    {
      "id": "governed-change#intent-match-fulfills-integrity",
      "type": "relationship"
    },
    {
      "id": "governed-change#interface-serves-member",
      "type": "relationship"
    },
    {
      "id": "governed-change#journey-realizes-capability",
      "type": "relationship"
    },
    {
      "id": "governed-change#member-performs-process",
      "type": "relationship"
    },
    {
      "id": "governed-change#no-anonymous-approval",
      "type": "concept"
    },
    {
      "id": "governed-change#owner-concerned-with-integrity",
      "type": "relationship"
    },
    {
      "id": "governed-change#process-realizes-publication",
      "type": "relationship"
    },
    {
      "id": "governed-change#process-writes-record",
      "type": "relationship"
    },
    {
      "id": "governed-change#product-owner",
      "type": "concept"
    },
    {
      "id": "governed-change#proposal",
      "type": "concept"
    },
    {
      "id": "governed-change#proposal-drift",
      "type": "concept"
    },
    {
      "id": "governed-change#proposal-intent-match",
      "type": "concept"
    },
    {
      "id": "governed-change#publication-serves-member",
      "type": "relationship"
    },
    {
      "id": "governed-change#request-triggers-verification",
      "type": "relationship"
    },
    {
      "id": "governed-change#reviewed-change-integrity",
      "type": "concept"
    },
    {
      "id": "governed-change#risk-causes-drift",
      "type": "relationship"
    },
    {
      "id": "governed-change#runtime-realizes-execution",
      "type": "relationship"
    },
    {
      "id": "governed-change#safe-change-journey",
      "type": "concept"
    },
    {
      "id": "governed-change#structured-traceability",
      "type": "concept"
    },
    {
      "id": "governed-change#suite-realizes-traceability",
      "type": "relationship"
    },
    {
      "id": "governed-change#traceability-associated-with-foundation",
      "type": "relationship"
    },
    {
      "id": "governed-change#verification-reads-digest",
      "type": "relationship"
    },
    {
      "id": "governed-change#verification-reads-proposal",
      "type": "relationship"
    },
    {
      "id": "governed-change#verification-realizes-decision",
      "type": "relationship"
    },
    {
      "id": "governed-change#verify-intent",
      "type": "concept"
    },
    {
      "id": "governed-change#worker-runtime",
      "type": "concept"
    },
    {
      "id": "governed-change#yarramate-adoption",
      "type": "concept"
    }
  ],
  "claims": [
    {
      "id": "governed-change#adoption-realizes-suite",
      "subject": "governed-change#yarramate-adoption",
      "predicate": "yarramate/core@0.1#realization",
      "object": {
        "ref": "governed-change#conformance-suite"
      },
      "origin": "declared",
      "source": {
        "document": "governed-change",
        "path": "test/fixtures/valid/governed-change.yaml",
        "pointer": "/relationships/25",
        "line": 221,
        "column": 5
      }
    },
    {
      "id": "governed-change#adoption-realizes-suite~name",
      "subject": "governed-change#adoption-realizes-suite",
      "predicate": "yarramate/relationship/name",
      "object": {
        "value": "delivers"
      },
      "origin": "declared",
      "source": {
        "document": "governed-change",
        "path": "test/fixtures/valid/governed-change.yaml",
        "pointer": "/relationships/25/name",
        "line": 225,
        "column": 11
      }
    },
    {
      "id": "governed-change#ai-change-risk~kind",
      "subject": "governed-change#ai-change-risk",
      "predicate": "yarramate/concept/kind",
      "object": {
        "value": "yarramate/core@0.1#driver"
      },
      "origin": "declared",
      "source": {
        "document": "governed-change",
        "path": "test/fixtures/valid/governed-change.yaml",
        "pointer": "/concepts/1/kind",
        "line": 9,
        "column": 11
      }
    },
    {
      "id": "governed-change#ai-change-risk~name",
      "subject": "governed-change#ai-change-risk",
      "predicate": "yarramate/concept/name",
      "object": {
        "value": "Risk from AI-authored change"
      },
      "origin": "declared",
      "source": {
        "document": "governed-change",
        "path": "test/fixtures/valid/governed-change.yaml",
        "pointer": "/concepts/1/name",
        "line": 10,
        "column": 11
      }
    },
    {
      "id": "governed-change#approval-artifact~kind",
      "subject": "governed-change#approval-artifact",
      "predicate": "yarramate/concept/kind",
      "object": {
        "value": "yarramate/core@0.1#artifact"
      },
      "origin": "declared",
      "source": {
        "document": "governed-change",
        "path": "test/fixtures/valid/governed-change.yaml",
        "pointer": "/concepts/24/kind",
        "line": 78,
        "column": 11
      }
    },
    {
      "id": "governed-change#approval-artifact~name",
      "subject": "governed-change#approval-artifact",
      "predicate": "yarramate/concept/name",
      "object": {
        "value": "Sealed approval artifact"
      },
      "origin": "declared",
      "source": {
        "document": "governed-change",
        "path": "test/fixtures/valid/governed-change.yaml",
        "pointer": "/concepts/24/name",
        "line": 79,
        "column": 11
      }
    },
    {
      "id": "governed-change#approval-decision~kind",
      "subject": "governed-change#approval-decision",
      "predicate": "yarramate/concept/kind",
      "object": {
        "value": "yarramate/core@0.1#applicationService"
      },
      "origin": "declared",
      "source": {
        "document": "governed-change",
        "path": "test/fixtures/valid/governed-change.yaml",
        "pointer": "/concepts/18/kind",
        "line": 60,
        "column": 11
      }
    },
    {
      "id": "governed-change#approval-decision~name",
      "subject": "governed-change#approval-decision",
      "predicate": "yarramate/concept/name",
      "object": {
        "value": "Approval decision"
      },
      "origin": "declared",
      "source": {
        "document": "governed-change",
        "path": "test/fixtures/valid/governed-change.yaml",
        "pointer": "/concepts/18/name",
        "line": 61,
        "column": 11
      }
    },
    {
      "id": "governed-change#approval-interface~kind",
      "subject": "governed-change#approval-interface",
      "predicate": "yarramate/concept/kind",
      "object": {
        "value": "yarramate/core@0.1#applicationInterface"
      },
      "origin": "declared",
      "source": {
        "document": "governed-change",
        "path": "test/fixtures/valid/governed-change.yaml",
        "pointer": "/concepts/15/kind",
        "line": 51,
        "column": 11
      }
    },
    {
      "id": "governed-change#approval-interface~name",
      "subject": "governed-change#approval-interface",
      "predicate": "yarramate/concept/name",
      "object": {
        "value": "Approval interface"
      },
      "origin": "declared",
      "source": {